{
  "schema_version":"v1",
  "request_id":"demo-001",
  "strategy_id":"momentum_v1",
  "strategy_version":"1.0.0",
  "as_of":"2026-10-08",
  "snapshot_hash":"aaaaaaaaaaaaaaaaaaaaaaaaaaaaaaaaaaaaaaaaaaaaaaaaaaaaaaaaaaaaaaaa",
  "status":"success",
  "results":[{"ts_code":"000001.SZ","momentum_60":0.1,"momentum_20":0.04,"amount_activity_20":0.6931471805599453,"volatility_20":0.20,"ma20":10.5,"avg_amount_20_yuan":50000000.0}],
  "errors":[]
}
